a,b,c,word
a, a, a, qgjbeeaada
a, a, b, rgkbefaadb
a, a, c, sglbegaadc
a, a, d, tgmbehaadd
a, a, e, ugnbeiaade
a, a, f, vgobejaadf
a, a, g, wgpbekaadg
a, a, h, xgqbelaadh
a, a, i, ygrbemaadi
a, a, j, zgsbenaadj
a, b, a, tikcfeabda
a, b, b, uilcffabdb
a, b, c, vimcfgabdc
a, b, d, wincfhabdd
a, b, e, xiocfiabde
a, b, f, yipcfjabdf
a, b, g, ziqcfkabdg
a, c, a, wkldgeacda
a, c, b, xkmdgfacdb
a, c, c, ykndggacdc
a, c, d, zkodghacdd
a, d, a, zmmeheadda
b, a, a, rhjceebada
b, a, b, shkcefbadb
b, a, c, thlcegbadc
b, a, d, uhmcehbadd
b, a, e, vhnceibade
b, a, f, whocejbadf
b, a, g, xhpcekbadg
b, a, h, yhqcelbadh
b, a, i, zhrcembadi
b, b, a, ujkdfebbda
b, b, b, vjldffbbdb
b, b, c, wjmdfgbbdc
b, b, d, xjndfhbbdd
b, b, e, yjodfibbde
b, b, f, zjpdfjbbdf
b, c, a, xllegebcda
b, c, b, ylmegfbcdb
b, c, c, zlneggbcdc
c, a, a, sijdeecada
c, a, b, tikdefcadb
c, a, c, uildegcadc
c, a, d, vimdehcadd
c, a, e, windeicade
c, a, f, xiodejcadf
c, a, g, yipdekcadg
c, a, h, ziqdelcadh
c, b, a, vkkefecbda
c, b, b, wkleffcbdb
c, b, c, xkmefgcbdc
c, b, d, yknefhcbdd
c, b, e, zkoeficbde
c, c, a, ymlfgeccda
c, c, b, zmmfgfccdb
d, a, a, tjjeeedada
d, a, b, ujkeefdadb
d, a, c, vjleegdadc
d, a, d, wjmeehdadd
d, a, e, xjneeidade
d, a, f, yjoeejdadf
d, a, g, zjpeekdadg
d, b, a, wlkffedbda
d, b, b, xllfffdbdb
d, b, c, ylmffgdbdc
d, b, d, zlnffhdbdd
d, c, a, znlggedcda
e, a, a, ukjfeeeada
e, a, b, vkkfefeadb
e, a, c, wklfegeadc
e, a, d, xkmfeheadd
e, a, e, yknfeieade
e, a, f, zkofejeadf
e, b, a, xmkgfeebda
e, b, b, ymlgffebdb
e, b, c, zmmgfgebdc
f, a, a, vljgeefada
f, a, b, wlkgeffadb
f, a, c, xllgegfadc
f, a, d, ylmgehfadd
f, a, e, zlngeifade
f, b, a, ynkhfefbda
f, b, b, znlhfffbdb
g, a, a, wmjheegada
g, a, b, xmkhefgadb
g, a, c, ymlheggadc
g, a, d, zmmhehgadd
g, b, a, zokifegbda
h, a, a, xnjieehada
h, a, b, ynkiefhadb
h, a, c, znlieghadc
i, a, a, yojjeeiada
i, a, b, zokjefiadb
j, a, a, zpjkeejada
